"Uf","IBGE","Municipio","CNES","Estabelecimento","INE","Sigla da equipe","Populaçao"
"MS","500370","DOURADOS","2710897","UNIDADE BASICA DE SAUDE VILA ROSA","0001638572","eAP","3708"
"MS","500200","BATAYPORÃ","2376717","ESTRATEGIA DE SAUDE DA FAMILIA SANTA LUZIA","0001689118","eAPP","13"
"MS","500270","CAMPO GRANDE","0010162","SESAU UBS DR IVAN HIDELBRAND DA COSTA BURITI","0000439053","-","2952"
"MS","500270","CAMPO GRANDE","0010162","SESAU UBS DR IVAN HIDELBRAND DA COSTA BURITI","0000439061","-","2693"
"MS","500270","CAMPO GRANDE","0024430","SESAU UBS DR GERMANO BARROS DE SOUZA UNIVERSITARIO","0000439703","-","3474"
"MS","500270","CAMPO GRANDE","0024430","SESAU UBS DR GERMANO BARROS DE SOUZA UNIVERSITARIO","0000439711","-","2626"
"MS","500270","CAMPO GRANDE","0024473","SESAU UBS BAIRRO CORONEL ANTONINO","0000439835","-","2385"
"MS","500270","CAMPO GRANDE","0010154","SESAU UBS DR ASTROGILDO CARMONA CARLOTA","0001482696","-","2824"
"MS","500270","CAMPO GRANDE","0024473","SESAU UBS BAIRRO CORONEL ANTONINO","0001675958","-","2938"
"MS","500790","SIDROLÂNDIA","7040938","POSTO DE SAUDE INDIGENA ALDEIA TERERE","0002123614","eAP","0"
"MS","500270","CAMPO GRANDE","0010251","SESAU UBS DR ALBERTO NEDER CAICARA","0000439282","-","2067"
"MS","500470","IVINHEMA","2676567","ESF GUIRAY","0001543490","eAPP","224"
"MS","500730","RIO NEGRO","2646862","UNIDADE BASICA DE SAUDE RIO NEGRO","0001554220","eAPP","15"
"MS","500240","CAARAPÓ","2376180","POLICLINICA CAARAPO","0001565524","eAPP","177"
"MS","500660","PONTA PORÃ","6032826","UNIDADE PRISIONAL MASCULINA DE PONTA PORA","0000444065","eAPP","1291"
"MS","500330","COXIM","7468407","UNIDADE PRISIONAL AGEPEN COXIM","0001519859","eAPP","598"
"MS","500570","NAVIRAÍ","6150616","UNIDADE DE SAUDE PRISIONAL","0000443344","eAPP","1262"
"MS","500348","DOIS IRMÃOS DO BURITI","6254896","PENITENCIARIA DE DOIS IRMAOS DO BURITI","0000441627","eAPP","753"
"MS","500270","CAMPO GRANDE","7975783","MODULO DE SAUDE DO COMPLEXO PENITENCIARIO DE CAMPO GRANDE MS","0001613480","eAPP","3438"
"MS","500830","TRÊS LAGOAS","2757044","UNIDADE BASICA DE SAUDE ALTAIR CABRAL TRANIM","0002172216","eAP-30h","0"
"MS","500620","NOVA ANDRADINA","3881032","ESF CENTRO","0001711717","eSF","1486"
"MS","500270","CAMPO GRANDE","7096895","SESAU USF DR HELIO MARTINS COELHO BATISTAO","0001707906","eSF","1802"
"MS","500270","CAMPO GRANDE","0301825","SESAU USF DRA REGIA JUSSARA F DE BARROS AERO RANCHO GRANJA","0002127342","eSF","2834"
"MS","500270","CAMPO GRANDE","9983449","SESAU USF DR CARLOS A JURGIELEWCZ CRISTO REDENTOR","0001717359","eSF","2425"
"MS","500270","CAMPO GRANDE","0028789","SESAU USF DR JUDSON TADEU RIBAS MORENINHA III","0001705792","eSF","2329"
"MS","500620","NOVA ANDRADINA","0187941","ESF UNIVERSITARIO","0002022532","eSF","2133"
"MS","500510","JATEÍ","2646803","UNIDADE DE SAUDE DA FAMILIA GLEBA NOVA ESPERANCA","0000442909","eSF","1439"
"MS","500830","TRÊS LAGOAS","9615946","UBS NOVO OESTE PASTOR MARCOS ROGERIO","0001655841","eSF","5082"
"MS","500320","CORUMBÁ","2376105","UNIDADE BASICA DE SAUDE BRENO DE MEDEIROS","0000441074","eSF","4295"
"MS","500370","DOURADOS","2710862","UNIDADE BASICA DE SAUDE DR MOACIR STEIN ARRUDA","0000441732","eSF","2361"
"MS","500370","DOURADOS","5592607","UNIDADE BASICA DE SAUDE LEVY SCHAUZ CABECEIRA ALEGRE","0001623125","eSF","2665"
"MS","500270","CAMPO GRANDE","0024422","SESAU USF DR ALBINO COIMBRA SANTA CARMELIA","0001614843","eSF","2622"
"MS","500568","MUNDO NOVO","2536846","UNIDADE DE SAUDE DA FAMILIA II MUNDO NOVO","0000443247","eSF","4176"
"MS","500568","MUNDO NOVO","3463567","UNIDADE DE SAUDE DA FAMILIA III","0000443255","eSF","3394"
"MS","500570","NAVIRAÍ","5322804","ESF RONAN MARQUES","0000443301","eSF","4434"
"MS","500570","NAVIRAÍ","9912835","ESF IPE","0001687301","eSF","1628"
"MS","500620","NOVA ANDRADINA","2612062","ESF IRMAN RIBEIRO","0000443573","eSF","4735"
"MS","500640","PEDRO GOMES","2676885","UNIDADE SAUDE DA FAMILIA DO CENTRO DE SAUDE","0000443891","eSF","3309"
"MS","500660","PONTA PORÃ","5683238","UNIDADE BASICA DE SAUDE DA FAMILIA ITAMARATI","0000444014","eSF","4477"
"MS","500660","PONTA PORÃ","5870178","UNIDADE BASICA DE SAUDE DA FAMILIA DR NERY DE AZAMBUJA","0000444022","eSF","5650"
"MS","500348","DOIS IRMÃOS DO BURITI","7551827","UNIDADE BASICA DE SAUDE BAIRRO VILA NOVA","0000441600","eSF","2409"
"MS","500370","DOURADOS","2710862","UNIDADE BASICA DE SAUDE DR MOACIR STEIN ARRUDA","0000441716","eSF","3382"
"MS","500370","DOURADOS","2711125","UNIDADE BASICA DE SAUDE PARQUE DAS NACOES II","0000441988","eSF","3129"
"MS","500370","DOURADOS","3239837","UNIDADE BASICA DE SAUDE ANTONIO DA COSTA CARVALHO","0000442054","eSF","3432"
"MS","500370","DOURADOS","5592615","UNIDADE BASICA DE SAUDE DR JOAQUIM LOURENCO FILHO","0000442143","eSF","4276"
"MS","500375","ELDORADO","5395062","PROGRAMA DE SAUDE DA FAMILIA OSVALDO TURQUINO","0000442259","eSF","4390"
"MS","500400","GLÓRIA DE DOURADOS","2376504","UNIDADE BASICA DE SAUDE DE GLORIA DE DOURADOS","0000442348","eSF","3251"
"MS","500400","GLÓRIA DE DOURADOS","2558718","UNIDADE DE SAUDE DA FAMILIA COHAB","0000442356","eSF","1989"
"MS","500410","GUIA LOPES DA LAGUNA","2376229","UNIDADE DE SAUDE DA FAMILIA RANOLFO PEREIRA DA SILVA","0000442372","eSF","3572"
"MS","500440","INOCÊNCIA","2536803","UESF SEBASTIAO FRANCISCO RAMOS","0000442488","eSF","1488"
"MS","500070","ANASTÁCIO","6621058","ESF MARIA FRANCISCA DE LIMA","0000437883","eSF","2356"
"MS","500085","ANGÉLICA","2376601","ESF DR MARCIO ROGERIO CAMARGO","0000437980","eSF","1827"
"MS","500085","ANGÉLICA","6958451","ESF LAURO DOMINGOS DE SOUZA","0000438006","eSF","2972"
"MS","500100","APARECIDA DO TABOADO","5884179","ESF JARDIM DAS FLORES","0000438111","eSF","5121"
"MS","500124","ARAL MOREIRA","2591391","POSTO DE SAUDE ELIANA FERREIRA MACHADO","0000438332","eSF","1277"
"MS","500124","ARAL MOREIRA","3276740","POSTO DE SAUDE VISTA ALEGRE","0001512498","eSF","1055"
"MS","500190","BATAGUASSU","2371014","UNIDADE DE SAUDE JD SAO FRANCISCO","0000438383","eSF","2837"
"MS","500769","SÃO GABRIEL DO OESTE","2599376","UNIDADE DE SAUDE DA FAMILIA VI","0000444529","eSF","3802"
"MS","500790","SIDROLÂNDIA","2370840","SAUDE LAR DO DISTRITO DE QUEBRA COCO","0000444685","eSF","1660"
"MS","500793","SONORA","2376911","UNIDADE DE SAUDE DA FAMILIA DE SONORA","0000444855","eSF","4648"
"MS","500830","TRÊS LAGOAS","2757087","ESTRATEGIA DE SAUDE DA FAMILIA JUPIA","0000445053","eSF","2278"
"MS","500830","TRÊS LAGOAS","2757168","ESF VILA PILOTO ADRIANA CRISTINA DE QUEIROZ GORGA","0000445207","eSF","2612"
"MS","500270","CAMPO GRANDE","0028835","SESAU USF DR BENJAMIM ASATO PARQUE DO SOL","0000439975","eSF","3729"
"MS","500270","CAMPO GRANDE","3023737","SESAU USF VILA CORUMBA","0000440086","eSF","3711"
"MS","500270","CAMPO GRANDE","3080021","SESAU USF DR EMILIO GARBELOTI NETO TARUMA","0000440191","eSF","1894"
"MS","500270","CAMPO GRANDE","6585612","SESAU USF AQUINO DIAS BEZERRA VIDA NOVA","0000440566","eSF","3820"
"MS","500270","CAMPO GRANDE","7096895","SESAU USF DR HELIO MARTINS COELHO BATISTAO","0000440647","eSF","2918"
"MS","500190","BATAGUASSU","9060588","ESF LUCIO FERREIRA ROSA","0001612301","eSF","3632"
"MS","500210","BELA VISTA","2710633","ESF DR RUBENS ALBERTO ABOTT DE CASTRO PINTO AGUA DOCE","0000438561","eSF","2773"
"MS","500215","BODOQUENA","2676745","UNIDADE BASICA DE SAUDE JESUINO ORMUNDO","0000438650","eSF","1701"
"MS","500270","CAMPO GRANDE","0010197","SESAU USF DR SUMIE IKEDA RODRIGUES SERRADINHO","0000439169","eSF","3863"
"MS","500270","CAMPO GRANDE","0028835","SESAU USF DR BENJAMIM ASATO PARQUE DO SOL","0000439967","eSF","3815"
"MS","500270","CAMPO GRANDE","3051358","SESAU USF DR WAGNER JOSE BORTOTTO GARCIA MARIO COVAS","0000440124","eSF","3133"
"MS","500793","SONORA","3236455","UNIDADE DE SAUDE DA FAMILIA BOM FUTURO","0000444898","eSF","3923"
"MS","500793","SONORA","7775318","UNIDADE DE SAUDE DA FAMILIA JOSE DA SILVA","0001581813","eSF","1084"
"MS","500795","TACURU","5683386","UNIDADE BASICA DE SAUDE DA FAMILIA AURELIANO DURE","0000444928","eSF","1477"
"MS","500830","TRÊS LAGOAS","6343864","ESTRATEGIA DE SAUDE DA FAMILIA JARDIM MARISTELA","0000445258","eSF","6200"
"MS","500830","TRÊS LAGOAS","2757060","ESF INTERLAGOS GABRIEL MARQUES FERNANDES","0001685597","eSF","2828"
"MS","500270","CAMPO GRANDE","9022007","SESAU USF ANA MARIA DO COUTO","0001482602","eSF","3061"
"MS","500270","CAMPO GRANDE","7568835","SESAU USF MARIA IVONE DE O NASCIMENTO ARAKAKI VILA FERNANDA","0001644483","eSF","3588"
"MS","500270","CAMPO GRANDE","0010413","SESAU USF DR SONI LYDIA SOUZA WOLF MACAUBAS","0001644718","eSF","2422"
"MS","500270","CAMPO GRANDE","3051374","SESAU USF DRA ALDA GUEDES GARCIA OLIVEIRA JARDIM AZALEIA","0001644769","eSF","2622"
"MS","500280","CARACOL","2620138","ESF LIDIANE DE OLIVEIRA GARDIN GALEANO","0000440825","eSF","3063"
"MS","500290","CASSILÂNDIA","2375710","UNIDADE BASICA DE SAUDE DR ANTONIO TEIXEIRA DE LIMA","0000440833","eSF","2856"
"MS","500320","CORUMBÁ","2536684","UNIDADE BASICA DE SAUDE NOVA CORUMBA","0000441163","eSF","3657"
"MS","500345","DEODÁPOLIS","2558823","ESTRATEGIA DE SAUDE DA FAMILIA SANTO ANTONIO","0000441546","eSF","3116"
"MS","500370","DOURADOS","2710838","UNIDADE BASICA DE SAUDE ALTAIR RAMIRES DE SOUZA DONA NEGA","0000441686","eSF","2283"
"MS","500370","DOURADOS","2711044","UNIDADE BASICA DE SAUDE ANTONIA MARQUES VILA VARGAS","0000441848","eSF","2578"
"MS","500370","DOURADOS","5592593","UNIDADE BASICA DE SAUDE DRA HELENA YOSHIE MORIBE","0001623109","eSF","3160"
"MS","500270","CAMPO GRANDE","7096887","SESAU USF DR NELSON TOKUEI SIMABUKURO AERO RANCHO IV","0000440604","eSF","3722"
"MS","500295","CHAPADÃO DO SUL","2559013","UNIDADE DE SAUDE DA FAMILIA SAUDE LAR","0000440957","eSF","5288"
"MS","500320","CORUMBÁ","2591405","UNIDADE BASICA DE SAUDE DRA LUCIA MARIA PEREIRA DE CARVALHO","0000441228","eSF","2897"
"MS","500380","FÁTIMA DO SUL","2599392","ESTRATEGIA SAUDE DA FAMILIA JARDIM O PIONEIRO","0000442305","eSF","3723"
"MS","500430","IGUATEMI","5342244","UNIDADE DE SAUDE DA FAMILIA ASSENTAMENTO AUXILIADORA","0000442445","eSF","1877"
"MS","500490","JARAGUARI","2651467","UNIDADE DE SAUDE FAMILIA I","0001483129","eSF","1612"
"MS","500540","MARACAJU","2470659","UBS VITORIA MARCONDES TERRA ESF JOSE ALVES MARCONDES","0000443085","eSF","2475"
"MS","500540","MARACAJU","5304830","UBS ESF BALBINO CORREIA DE LIMA","0000443123","eSF","4304"
"MS","500580","NIOAQUE","2376342","UNIDADE DE SAUDE FAMILIA UIRAPURU","0000443409","eSF","965"
"MS","500600","NOVA ALVORADA DO SUL","2482517","UNIDADE BASICA DE SAUDE DA FAMILIA IZABEL MENEZES COELHO","0000443476","eSF","5020"
"MS","500620","NOVA ANDRADINA","2600374","ESF MORADA DO SOL","0000443530","eSF","4571"
"MS","500620","NOVA ANDRADINA","3881032","ESF CENTRO","0000443611","eSF","5268"
"MS","500630","PARANAÍBA","3050270","UNIDADE SAUDE DA FAMILIA SANTA LUCIA","0000443743","eSF","1982"
"MS","500630","PARANAÍBA","5927056","UNIDADE SAUDE DA FAMILIA HILDA DA SILVA OLIVEIRA","0000443808","eSF","3226"
"MS","500200","BATAYPORÃ","2376733","ESTRATEGIA DE SAUDE DA FAMILIA SAO LUIZ","0000438502","eSF","1035"
"MS","500230","BRASILÂNDIA","2599481","UNIDADE SAUDE DA FAMILIA I BRASILANDIA","0000438715","eSF","3770"
"MS","500230","BRASILÂNDIA","9139249","UNIDADE BASICA DE SAUDE JOSE FRANCISCO MARQUES NETO","0000438758","eSF","3459"
"MS","500660","PONTA PORÃ","5971918","UNIDADE BASICA DE SAUDE DA FAMILIA VILA AUREA","0000444057","eSF","6042"
"MS","500720","RIO BRILHANTE","2804522","ESTRATEGIA SAUDE DA FAMILIA RURAL","0000444227","eSF","1824"
"MS","500750","ROCHEDO","2376067","UNIDADE DE SAUDE DA FAMILIA DE ROCHEDO","0000444421","eSF","4274"
"MS","500790","SIDROLÂNDIA","9913041","EQUIPE DE ESF MOVEL","0001687670","-","1627"
"MS","500830","TRÊS LAGOAS","2757052","EACS EURIDICE CHAGAS CRUZ","0000445010","-","2614"
"MS","500270","CAMPO GRANDE","0024449","SESAU UBS DR JOAO PEREIRA DA ROSA AERO RANCHO","0000439738","-","2803"
"MS","500270","CAMPO GRANDE","6918956","PENITENCIARIA FEDERAL DE CAMPO GRANDE MS","0000440590","eAPP","0"
"MS","500740","RIO VERDE DE MATO GROSSO","0650196","UNIDADE DE SAUDE PRISIONAL DE RIO VERDE","0002175177","eAPP","0"
"MS","500090","ANTÔNIO JOÃO","2710625","ESF SALVANI SIMPLICIO FREITAS","0001687093","eAPP","2"
"MS","500270","CAMPO GRANDE","0010367","SESAU UBS DR CELSO LACERDA DE AZEVEDO PIONEIRA","0000439517","-","2561"
"MS","500790","SIDROLÂNDIA","5134609","PSF CLEIDE PIRAN","0001556215","eAPP","171"
"MS","500295","CHAPADÃO DO SUL","7549903","UNIDADE ESTRATEGIA DA SAUDE DA FAMILIA CENTRAL","0001550403","eAPP","286"
"MS","500500","JARDIM","7575211","DELEGACIA DE POLICIA CIVIL","0001551973","eAPP","1"
"MS","500720","RIO BRILHANTE","6229387","PENITENCIARIA FEMININA DE RIO BRILHANTE","0001550381","eAPP","173"
"MS","500769","SÃO GABRIEL DO OESTE","6225616","ESTABELECIMENTO PENAL FEMININO DE SAO GABRIEL DO OESTE","0001543091","eAPP","181"
"MS","500230","BRASILÂNDIA","2612003","UNIDADE BASICA DE SAUDE DE BRASILANDIA","0001545094","eAPP","66"
"MS","500290","CASSILÂNDIA","5608813","UNIDADE BASICA DE SAUDE DO SISTEMA PRISIONAL","0000440922","eAPP","408"
"MS","500270","CAMPO GRANDE","9518231","ESTAB PENAL DE SEGURANCA MAXIMA JAIR FERREIRA DE CARVALHO","0001662392","eAPP","2255"
"MS","500755","SANTA RITA DO PARDO","3010708","ESTRATEGIA DE SAUDE DA FAMILIA JOSE GISFREDO","0000444456","eSF","3346"
"MS","500793","SONORA","2376938","UNIDADE BASICA DE SAUDE DE SONORA","0000444863","eAP-20h","466"
"MS","500270","CAMPO GRANDE","0024457","SESAU USF DR ANTONIO PEREIRA TIRADENTES","0000439762","eSF","1676"
"MS","500270","CAMPO GRANDE","0028851","SESAU USF ALFREDO NEDER COOPHAVILA II","0000440000","eSF","2271"
"MS","500270","CAMPO GRANDE","3051927","SESAU USF DR JURANDYR DE CASTRO COIMBRA ZE PEREIRA","0000440175","eSF","2755"
"MS","500830","TRÊS LAGOAS","2757117","ESTRATEGIA DE SAUDE DA FAMILIA SANTA RITA","0001691716","eSF","2291"
"MS","500270","CAMPO GRANDE","9013415","SESAU USF PEDRO FELIX DE SOUZA PARADISO","0001678469","eSF","1976"
"MS","500270","CAMPO GRANDE","0021792","SESAU USF DR BENTO DE ASSIS MACHADO ANHANDUI","0002163845","eSF","147"
"MS","500270","CAMPO GRANDE","0301825","SESAU USF DRA REGIA JUSSARA F DE BARROS AERO RANCHO GRANJA","0002127350","eSF","1930"
"MS","500510","JATEÍ","2620146","UNIDADE DE SAUDE DA FAMILIA DE JATEI","0000442895","eSF","2110"
"MS","500370","DOURADOS","2711117","UNIDADE BASICA DE SAUDE MOTOHIDE HIRAISHI MARACANA","0000441945","eSF","4901"
"MS","500270","CAMPO GRANDE","0024341","SESAU USF EDSON QUINTINO MENDES JARDIM ITAMARACA","0001482378","eSF","2579"
"MS","500540","MARACAJU","7752431","UBS SR MIGUEL PEDROSO FERREIRA ESF EGIDIO RIBEIRO","0001579541","eSF","4454"
"MS","500620","NOVA ANDRADINA","6669239","ESF VILA BEATRIZ","0000443638","eSF","4196"
"MS","500660","PONTA PORÃ","9042849","UNIDADE BASICA DE SAUDE DA FAMILIA DR JOSE ISSA","0000443972","eSF","4480"
"MS","500660","PONTA PORÃ","9075062","UNIDADE DE SAUDE DA FAMILIA ENFERMEIRA ELIZA MEDINA BARRETO","0001635379","eSF","3987"
"MS","500660","PONTA PORÃ","2361019","UNIDADE BASICA DE SAUDE DA FAMILIA CABECEIRA DO APA","0001534106","eSF","1245"
"MS","500350","DOURADINA","2536714","UNIDADE SAUDE LAR DE DOURADINA","0000441643","eSF","2558"
"MS","500370","DOURADOS","2711052","UNIDADE BASICA DE SAUDE FREI HUGOLINO BECKER","0000441856","eSF","2859"
"MS","500370","DOURADOS","2711079","UNIDADE BASICA DE SAUDE JARDIM PIRATININGA","0000441872","eSF","3629"
"MS","500370","DOURADOS","2711095","UNIDADE BASICA DE SAUDE TAKEO TAKIMOTO OURO VERDE","0000441899","eSF","4249"
"MS","500370","DOURADOS","5592615","UNIDADE BASICA DE SAUDE DR JOAQUIM LOURENCO FILHO","0000442135","eSF","2496"
"MS","500430","IGUATEMI","2482592","UNIDADE DE SAUDE DA FAMILIA VILA OPERARIA","0000442410","eSF","3804"
"MS","500740","RIO VERDE DE MATO GROSSO","2375915","UNIDADE DE SAUDE DA FAMILIA CENTRO RIO VERDE","0000444359","eSF","2354"
"MS","500769","SÃO GABRIEL DO OESTE","2370999","UNIDADE DE SAUDE DA FAMILIA FENIX IV","0000444502","eSF","4040"
"MS","500060","AMAMBAI","2611961","UNIDADE DE SAUDE DA FAMILIA VILA GLORIA","0000437727","eSF","2990"
"MS","500100","APARECIDA DO TABOADO","6592910","ESF CENTRAL","0000438138","eSF","5331"
"MS","500110","AQUIDAUANA","7525877","UNIDADE DE SAUDE DA FAMILIA MODESTO PEREIRA","0001536605","eSF","1159"
"MS","500780","SELVÍRIA","6625169","ESF III ESTRETEGIA DA FAMILIA RURAL","0000444669","eSF","1381"
"MS","500797","TAQUARUSSU","7498454","ESTRATEGIA DE SAUDE DA FAMILIA II","0001528653","eSF","1459"
"MS","500270","CAMPO GRANDE","2752530","SESAU CF DRA MARCIA DE SA EARP NOVA LIMA","0000440035","eSF","2785"
"MS","500270","CAMPO GRANDE","3051374","SESAU USF DRA ALDA GUEDES GARCIA OLIVEIRA JARDIM AZALEIA","0000440159","eSF","1724"
"MS","500270","CAMPO GRANDE","3334406","SESAU USF NOVA ESPERANCA","0000440337","eSF","3270"
"MS","500190","BATAGUASSU","5734592","ESF DR RUBENS KIMURA","0000438421","eSF","4749"
"MS","500215","BODOQUENA","2676737","ESF 01 DR MARCIA LUIZA APARECIDA PATERLINI","0000438642","eSF","2740"
"MS","500220","BONITO","6416225","UNIDADE DE SAUDE DA FAMILIA DO CENTRO","0000438693","eSF","4130"
"MS","500270","CAMPO GRANDE","0010197","SESAU USF DR SUMIE IKEDA RODRIGUES SERRADINHO","0000439150","eSF","4028"
"MS","500270","CAMPO GRANDE","9439919","SESAU USF VILA COX SANTA LUZIA","0000439231","eSF","2014"
"MS","500270","CAMPO GRANDE","0010286","SESAU USF DR OLIMPIO CAVALHEIRO COHAB","0000439320","eSF","4047"
"MS","500270","CAMPO GRANDE","0010421","SESAU USF DRA MARLY ANNA TATTON BERG G PEREIRA MARABA","0000439576","eSF","3750"
"MS","500270","CAMPO GRANDE","0021679","SESAU USF DRA MARIA JOSE DE PAULI TRES BARRAS","0000439592","eSF","1463"
"MS","500270","CAMPO GRANDE","0028827","SESAU CF MARIA DE LOURDES DOS SANTOS PORTAL CAIOBA","0000439908","eSF","2549"
"MS","500270","CAMPO GRANDE","0028835","SESAU USF DR BENJAMIM ASATO PARQUE DO SOL","0000439940","eSF","3095"
"MS","500795","TACURU","2611988","UNIDADE DE SAUDE DA FAMILIA DE TACURU NAIR MARIA BRESSAN","0000444901","eSF","2530"
"MS","500800","TERENOS","5337135","POSTO DE SAUDE DA FAMILIA UNIDADE VILA JAMIL","0000444979","eSF","3132"
"MS","500830","TRÊS LAGOAS","2757125","ESTRATEGIA DE SAUDE DA FAMILIA SANTO ANDRE","0000445134","eSF","4250"
"MS","500830","TRÊS LAGOAS","9390693","ESF JARDIM ATENAS BISPO DOM MOREIRA","0001685465","eSF","3006"
"MS","500270","CAMPO GRANDE","0028827","SESAU CF MARIA DE LOURDES DOS SANTOS PORTAL CAIOBA","0001508326","eSF","3848"
"MS","500320","CORUMBÁ","2536676","UNIDADE BASICA DE SAUDE BEIRA RIO","0000441155","eSF","3038"
"MS","500320","CORUMBÁ","9191801","UNIDADE BASICA DE SAUDE JARDIM DOS ESTADOS","0001547852","eSF","3073"
"MS","500330","COXIM","0491977","ILDA APARECIDA COMETKI SAO JOSE","0000441422","eSF","3119"
"MS","500370","DOURADOS","2710854","UNIDADE BASICA DE SAUDE DR JULVIS ARRUDA MATOS IV PLANO","0000441708","eSF","3775"
"MS","500370","DOURADOS","2711133","UNIDADE BASICA DE SAUDE RAMAO VIEIRA CACHOEIRINHA","0000442003","eSF","3935"
"MS","500270","CAMPO GRANDE","6585612","SESAU USF AQUINO DIAS BEZERRA VIDA NOVA","0000440531","eSF","3319"
"MS","500270","CAMPO GRANDE","9443525","SESAU USF BENEDITO MARTINS GONCALVES OLIVEIRA II","0001667939","eSF","3032"
"MS","500295","CHAPADÃO DO SUL","7549903","UNIDADE ESTRATEGIA DA SAUDE DA FAMILIA CENTRAL","0001542990","eSF","5409"
"MS","500320","CORUMBÁ","0456462","UNIDADE BASICA DE SAUDE DR WALTER VICTORIO","0000441112","eSF","3905"
"MS","500320","CORUMBÁ","6564070","UNIDADE BASICA DE SAUDE ANGELICA ANACHE","0000441295","eSF","3330"
"MS","500380","FÁTIMA DO SUL","2536730","ESTRATEGIA SAUDE DA FAMILIA VILA EDUCACIONAL","0000442267","eSF","4427"
"MS","500450","ITAPORÃ","2361450","UNIDADE DE SAUDE DA FAMILIA COPACABANA","0000442542","eSF","1790"
"MS","500500","JARDIM","2376431","UNIDADE BASICA DE SAUDE NESTOR PEREIRA","0000442844","eSF","3863"
"MS","500520","LADÁRIO","7111592","UNIDADE BASICA DE SAUDE JOAQUIM DA COSTA E FARIA","0000443034","eSF","2297"
"MS","500060","AMAMBAI","2591413","UNIDADE DE SAUDE CENTRAL","0001544691","eSF","2270"
"MS","500080","ANAURILÂNDIA","2376679","ESTRATEGIA SAUDE DA FAMILIA 1 LUIZ RAMIRO DA SILVA","0000437948","eSF","894"
"MS","500110","AQUIDAUANA","2360217","UNIDADE DE SAUDE DA FAMILIA VILA PINHEIRO","0000438162","eSF","3761"
"MS","500110","AQUIDAUANA","2659662","UNIDADE DE SAUDE DA FAMILIA SANTA TEREZINHA","0000438189","eSF","3107"
"MS","500580","NIOAQUE","2611953","UNIDADE DE SAUDE DA FAMILIA COLONIA CONCEICAO","0000443417","eSF","2079"
"MS","500600","NOVA ALVORADA DO SUL","2482584","UNIDADE BASICA DE SAUDE DA FAMILIA LEONORA DIAS BRITO","0000443484","eSF","2126"
"MS","500620","NOVA ANDRADINA","2612038","ESF CENTRO EDUCACIONAL","0000443549","eSF","4404"
"MS","500620","NOVA ANDRADINA","2612046","ESF SAO VICENTE","0000443557","eSF","4195"
"MS","500625","NOVO HORIZONTE DO SUL","2599449","PROGRAMA SAUDE DA FAMILIA NOVO HORIZONTINO","0000443646","eSF","3128"
"MS","500630","PARANAÍBA","2536412","UNIDADE SAUDE DA FAMILIA DANIEL MARTINS FERREIRA","0000443700","eSF","2598"
"MS","500630","PARANAÍBA","3050319","UNIDADE SAUDE DA FAMILIA SANTO ANTONIO","0000443786","eSF","3008"
"MS","500660","PONTA PORÃ","2361000","UNIDADE BASICA DE SAUDE DA FAMILIA SANGA PUITA JOSE BATAGLIN","0000443905","eSF","4467"
"MS","500220","BONITO","5677467","ESF DA VILA AMERICA","0000438685","eSF","4346"
"MS","500260","CAMAPUÃ","2536560","UNIDADE DE SAUDE DA FAMILIA V VILA INDUSTRIAL","0000438847","eSF","1079"
"MS","500260","CAMAPUÃ","6375006","UNIDADE DE SAUDE DA FAMILIA VI RURAL","0000438901","eSF","2973"
"MS","500270","CAMPO GRANDE","0010146","SESAU USF DR ADEMAR GUEDES DE SOUZA MATA DO JACINTO","0000439002","eSF","2959"
"MS","500270","CAMPO GRANDE","0010200","SESAU USF DR HIROSE ADANIA BONANCA","0000439185","eSF","2584"
"MS","500270","CAMPO GRANDE","0010219","SESAU USF MANOEL SECCO THOME INDUBRASIL","0000439193","eSF","2411"
"MS","500270","CAMPO GRANDE","0010278","SESAU USF MARIA APARECIDA PEDROSSIAN","0000439290","eSF","3447"
"MS","500270","CAMPO GRANDE","9230246","SESAU USF DR SYRZIL WILSON MAKSOUD SIRIO LIBANES","0000439355","eSF","3706"
"MS","500660","PONTA PORÃ","5911192","UNIDADE DE SAUDE DA FAMILIA DR PEDRO MONTEIRO DE ALMEIDA","0000444030","eSF","5539"
"MS","500710","RIBAS DO RIO PARDO","2536943","ESTRATEGIA DE SAUDE DA FAMILIA MIGUEL PEREIRA DA SILVA","0000444146","eSF","3233"
"MS","500720","RIO BRILHANTE","3865657","ESTRATEGIA SAUDE DA FAMILIA CARLOS VOLPE","0000444251","eSF","3505"
"MS","500660","PONTA PORÃ","3830497","UNIDADE BASICA DE SAUDE DA FAMILIA JARDIM ALEGRETE","0000444006","eCR","67"
"MS","500370","DOURADOS","2710870","UNIDADE BASICA DE SAUDE MARLUCIA ARAUJO LUPINETTI","0000441767","-","2788"
"MS","500370","DOURADOS","0416614","UNIDADE BASICA DE SAUDE PRISIONAL SEMIABERTO MASCULINO","0002140497","eAPP","71"
"MS","500370","DOURADOS","2711109","UNIDADE BASICA DE SAUDE BIANOR ALVES DA SILVA SELETA","0001713701","-","1577"
"MS","500770","SETE QUEDAS","7679114","EQUIPE DE ATENCAO BASICA PRESIONAL DE SETE QUEDAS","0001575805","eAPP","0"
"MS","500270","CAMPO GRANDE","0024449","SESAU UBS DR JOAO PEREIRA DA ROSA AERO RANCHO","0000439754","-","2709"
"MS","500270","CAMPO GRANDE","0024465","SESAU UBS ENG ARTHUR HOKAMA DONA NETA GUANANDI","0000439819","-","3709"
"MS","500270","CAMPO GRANDE","0010154","SESAU UBS DR ASTROGILDO CARMONA CARLOTA","0000439029","-","3486"
"MS","500270","CAMPO GRANDE","0010324","SESAU UBS DR WILLIAN MACKSOUD ESTRELA DO SUL","0000439444","-","4534"
"MS","500270","CAMPO GRANDE","0024430","SESAU UBS DR GERMANO BARROS DE SOUZA UNIVERSITARIO","0000439681","-","3174"
"MS","500270","CAMPO GRANDE","0540978","CENTRO PENAL AGROINDUSTRIAL GAMELEIRA SEMI ABERTO CPAIG","0002177072","eAPP","0"
"MS","500260","CAMAPUÃ","6375014","UNIDADE DE SAUDE DA FAMILIA III CENTRAL","0001605992","eAPP","12"
"MS","500270","CAMPO GRANDE","0010170","SESAU UBS DR VESPASIANO BARBOSA MARTINS VILA POPULAR","0000439088","-","2565"
"MS","500270","CAMPO GRANDE","5456185","SESAU CENTRO DE ATENCAO PSICOSSOCIAL III AFRODITE D CONTI","0001687107","eAPP","3"
"MS","500210","BELA VISTA","6507050","ESF DR THYRSON LOUREIRO DE ALMEIDA","0001546333","eAPP","15"
"MS","500830","TRÊS LAGOAS","6092195","ESTABELECIMENTO PENAL FEMININO DE TRES LAGOAS","0000445215","eAPP","280"
"MS","500270","CAMPO GRANDE","7773145","ESTABELECIMENTO PENAL FEMININO IRMA IRMA ZORZI EPFIIZ","0001545248","eAPP","600"
"MS","500630","PARANAÍBA","6178774","UNIDADE DE SAUDE DO SISTEMA PRISIONAL","0000443816","eAPP","575"
"MS","500830","TRÊS LAGOAS","2757079","ESTRATEGIA DE AGENTES COMUNITARIOS DE SAUDE JOEL NEVES SILVA","0002172208","eAP-30h","0"
"MS","500480","JAPORÃ","2374382","UNIDADE BASICA DE SAUDE DE JAPORA","0000442747","eAP-30h","137"
"MS","500370","DOURADOS","3489159","UNIDADE BASICA DE SAUDE BEM TE VI","0001623052","eSF","2025"
"MS","500270","CAMPO GRANDE","6731198","SESAU USF DR FERNANDO DE ARRUDA TORRES JOSE TAVARES","0001644408","eSF","1847"
"MS","500270","CAMPO GRANDE","9983449","SESAU USF DR CARLOS A JURGIELEWCZ CRISTO REDENTOR","0001697544","eSF","2388"
"MS","500270","CAMPO GRANDE","9443525","SESAU USF BENEDITO MARTINS GONCALVES OLIVEIRA II","0001707892","eSF","1460"
"MS","500270","CAMPO GRANDE","0024457","SESAU USF DR ANTONIO PEREIRA TIRADENTES","0001707949","eSF","1466"
"MS","500320","CORUMBÁ","6590209","UNIDADE BASICA DE SAUDE DR PEDRO PAULO DE BARROS","0000441317","eSF","2900"
"MS","500270","CAMPO GRANDE","3198278","SESAU USF PAULO COELHO MACHADO","0000440213","eSF","2861"
"MS","500270","CAMPO GRANDE","3311260","SESAU USF PASTOR ELISEU FEITOSA DE ALENCAR SAO CONRADO","0000440299","eSF","3580"
"MS","500525","LAGUNA CARAPÃ","7477317","UNIDADE DE SAUDE DA FAMILIA URBANA II","0001522213","eSF","2588"
"MS","500540","MARACAJU","2470624","UBS ESF DR CLEMENTINO BARROS WANDERLEI","0001468448","eSF","4670"
"MS","500570","NAVIRAÍ","5966523","ESF MARIA DE LOURDES DOS SANTOS","0000443336","eSF","3887"
"MS","500635","PARANHOS","3005429","PROGRAMA DE SAUDE DA FAMILIA URBANA CENTRO","0000443859","eSF","4160"
